{
  "schemaVersion": "1.1.0",
  "id": "formula-hp-dark-wizard",
  "version": "1.0.0",
  "rulesetId": "mu-s4-global-reference",
  "status": "PUBLISHED",
  "confidence": "VERIFIED",
  "purpose": "Calculate visible base HP for the Dark Wizard family before equipment, options, buffs, private profiles, or undeclared modifiers.",
  "applicability": {
    "characterClassId": "class-dark-wizard",
    "evolutionIds": [
      "evolution-dark-wizard",
      "evolution-soul-master",
      "evolution-grand-master"
    ]
  },
  "inputs": [
    {
      "id": "character-level",
      "numericType": "INT32",
      "unit": "level",
      "numericBounds": {
        "minimum": 1,
        "minimumInclusive": true,
        "maximum": 2147483647,
        "maximumInclusive": true,
        "classification": "TECHNICAL"
      },
      "source": {
        "kind": "CONTEXT_VALUE",
        "valueId": "character-level"
      }
    },
    {
      "id": "vitality",
      "numericType": "INT64",
      "unit": "stat-point",
      "numericBounds": {
        "minimum": 15,
        "minimumInclusive": true,
        "classification": "FACTUAL",
        "evidenceRefs": ["evd-0021"]
      },
      "source": {
        "kind": "CONTEXT_VALUE",
        "valueId": "resolved-vitality"
      }
    }
  ],
  "output": {
    "id": "hp",
    "numericType": "INT64",
    "unit": "hp-point"
  },
  "strategy": {
    "kind": "EXPRESSION",
    "definition": "hp = 30 + (lvl - 1) + vit * 2",
    "dependencyFormulaRefs": []
  },
  "rounding": {
    "mode": "TRUNCATE",
    "stage": "visible-hp",
    "decimalPlaces": 0
  },
  "trace": {
    "stepIds": [
      "base",
      "level-contribution",
      "vitality-contribution",
      "raw-hp",
      "visible-hp"
    ],
    "rawOutputStepId": "raw-hp",
    "visibleOutputStepId": "visible-hp"
  },
  "constraints": [
    "Resolve class and evolution applicability before evaluating arithmetic.",
    "Use checked integer subtraction, multiplication, and addition.",
    "Truncate raw-hp toward zero at visible-hp."
  ],
  "evidenceRefs": ["evd-0021", "evd-0026"],
  "conflictIds": ["dsp-0003"],
  "testCaseRefs": [
    {
      "id": "hp-dark-wizard-base",
      "version": "1.0.0"
    },
    {
      "id": "hp-dark-wizard-level-step",
      "version": "1.0.0"
    },
    {
      "id": "hp-dark-wizard-vitality-step",
      "version": "1.0.0"
    },
    {
      "id": "hp-dark-wizard-combined-step",
      "version": "1.0.0"
    }
  ]
}
